{"baseline_id":"PPR-BL-EXAMPLE-001","chapter_id":"CH-EXAMPLE","volume_id":"VOL-EXAMPLE","approved_version":"approved-v5","copyedited_version":"ce-v5","proof_version":"proof-v1","output_version":null,"file_ids":["approved.docx","proof.pdf"],"hashes_or_fixity":["sha256:approved","sha256:proof"],"approved_variations":["VAR-EXAMPLE"],"stage":"proof","captured_at":"2026-08-14T00:00:00Z","captured_by":"PPR reviewer","access_status":"authorized"}
